{
  "schema_version": "1.1",
  "batch_id": "eval-tool-role-boundaries-20260712",
  "seller_id": "eval-content",
  "platform": "amazon",
  "market": "US",
  "collected_at": "2026-07-12T00:00:00Z",
  "mode": "synthetic_demo",
  "sources": [
    {
      "source_id": "ss-main",
      "provider": "sellersprite",
      "provider_variant": "mcp_research",
      "tool_name": "synthetic_product_market_keyword_bundle",
      "source_type": "synthetic",
      "locator": "synthetic://amazon-us/reusable-pet-hair-roller",
      "collected_at": "2026-07-12T00:00:00Z",
      "scope": "Synthetic Amazon US product, market, keyword, concentration and CPC evidence",
      "synthetic": true,
      "source_role": "direct_market_data",
      "allowed_dimensions": ["demand", "competition", "risk"],
      "read_only": true,
      "measurement_kind": "estimated",
      "data_window": "synthetic trailing 30 days",
      "metric_definition": "All values are fictional provider-shaped evaluation data"
    },
    {
      "source_id": "sif-main",
      "provider": "sif",
      "provider_variant": "mcp_analysis",
      "tool_name": "synthetic_traffic_and_ads_bundle",
      "source_type": "synthetic",
      "locator": "synthetic://amazon-us/reusable-pet-hair-roller/traffic",
      "collected_at": "2026-07-12T00:00:00Z",
      "scope": "Synthetic Amazon US traffic structure and advertising dependency evidence",
      "synthetic": true,
      "source_role": "direct_market_data",
      "allowed_dimensions": ["competition", "risk"],
      "read_only": true,
      "measurement_kind": "estimated",
      "data_window": "synthetic trailing 30 days",
      "metric_definition": "Traffic shares are fictional and do not prove total market demand"
    },
    {
      "source_id": "amazon-main",
      "provider": "synthetic_amazon_market",
      "tool_name": "fixture_market_snapshot",
      "source_type": "synthetic",
      "locator": "synthetic://amazon-us/home-cleaning",
      "collected_at": "2026-07-12T00:00:00Z",
      "scope": "Synthetic Amazon US demand and competition fixture",
      "synthetic": true,
      "source_role": "direct_market_data",
      "allowed_dimensions": ["demand", "competition", "risk"],
      "read_only": true,
      "measurement_kind": "estimated",
      "data_window": "synthetic trailing 30 days",
      "metric_definition": "Fictional offline evaluation values"
    },
    {
      "source_id": "cost-main",
      "provider": "synthetic_cost_fixture",
      "tool_name": "fixture_known_cost_formula",
      "source_type": "synthetic",
      "locator": "references/demo-data/eval-tool-role-boundaries.json#cost-main",
      "collected_at": "2026-07-12T00:00:00Z",
      "scope": "Synthetic known-cost margin and first-batch capital",
      "synthetic": true,
      "source_role": "official_reference",
      "allowed_dimensions": ["margin", "risk"],
      "read_only": true,
      "measurement_kind": "derived",
      "data_window": null,
      "metric_definition": "Fictional formula values for evaluation only"
    },
    {
      "source_id": "supply-main",
      "provider": "synthetic_1688_supply",
      "tool_name": "fixture_supply_snapshot",
      "source_type": "synthetic",
      "locator": "synthetic://1688/home-cleaning",
      "collected_at": "2026-07-12T00:00:00Z",
      "scope": "Synthetic supply price, MOQ, weight and lead time",
      "synthetic": true,
      "source_role": "direct_market_data",
      "allowed_dimensions": ["margin", "capability_fit", "risk"],
      "read_only": true,
      "measurement_kind": "declared",
      "data_window": "synthetic current quotation",
      "metric_definition": "Fictional supplier quotation for evaluation only"
    },
    {
      "source_id": "linkfox-creative",
      "provider": "linkfox",
      "provider_variant": "linkfox_creative",
      "tool_name": "synthetic_ai_product_image",
      "source_type": "synthetic",
      "locator": "synthetic://linkfox/creative-capability",
      "collected_at": "2026-07-12T00:00:00Z",
      "scope": "Synthetic statement that an AI image workflow is available",
      "synthetic": true,
      "source_role": "transformation_only",
      "allowed_dimensions": ["capability_fit"],
      "read_only": true,
      "measurement_kind": "declared",
      "transformations": ["linkfox_creative"],
      "data_window": null,
      "metric_definition": "Creative capability only; not demand or conversion evidence"
    },
    {
      "source_id": "ziniao-env",
      "provider": "ziniao",
      "tool_name": "synthetic_account_environment_statement",
      "source_type": "synthetic",
      "locator": "synthetic://seller-capability/ziniao",
      "collected_at": "2026-07-12T00:00:00Z",
      "scope": "Synthetic seller operating environment statement",
      "synthetic": true,
      "source_role": "capability_context",
      "allowed_dimensions": ["capability_fit"],
      "read_only": true,
      "measurement_kind": "declared",
      "data_window": null,
      "metric_definition": "No account, IP, cookie or login data is included"
    },
    {
      "source_id": "amz123-directory",
      "provider": "amz123",
      "tool_name": "synthetic_directory_entry",
      "source_type": "synthetic",
      "locator": "synthetic://directory/tool-list",
      "collected_at": "2026-07-12T00:00:00Z",
      "scope": "Synthetic tool-directory reference",
      "synthetic": true,
      "source_role": "discovery_only",
      "allowed_dimensions": [],
      "read_only": true,
      "measurement_kind": "declared",
      "data_window": null,
      "metric_definition": "Directory presence is not product evidence"
    },
    {
      "source_id": "lingxing-own",
      "provider": "lingxing",
      "tool_name": "synthetic_seller_report_export",
      "source_type": "synthetic",
      "locator": "synthetic://seller/eval-store-a/historical-report",
      "collected_at": "2026-07-12T00:00:00Z",
      "scope": "Synthetic first-party historical seller operations",
      "synthetic": true,
      "source_role": "seller_first_party_data",
      "allowed_dimensions": ["margin", "capability_fit", "risk"],
      "read_only": true,
      "measurement_kind": "observed",
      "data_window": "synthetic prior 90 days",
      "metric_definition": "Only represents the fictional seller scope",
      "account_scope_id": "eval_store_a"
    },
    {
      "source_id": "amazon-ads-academy",
      "provider": "amazon_ads",
      "provider_variant": "academy",
      "tool_name": "synthetic_learning_reference",
      "source_type": "synthetic",
      "locator": "synthetic://amazon-ads-academy/learning",
      "collected_at": "2026-07-12T00:00:00Z",
      "scope": "Synthetic official-learning reference",
      "synthetic": true,
      "source_role": "official_reference",
      "allowed_dimensions": [],
      "read_only": true,
      "measurement_kind": "declared",
      "data_window": null,
      "metric_definition": "Learning material is not live market evidence"
    },
    {
      "source_id": "google-translate",
      "provider": "google_translate",
      "tool_name": "synthetic_text_translation",
      "source_type": "synthetic",
      "locator": "synthetic://translation/en-zh",
      "collected_at": "2026-07-12T00:00:00Z",
      "scope": "Synthetic translation transformation",
      "synthetic": true,
      "source_role": "transformation_only",
      "allowed_dimensions": [],
      "read_only": true,
      "measurement_kind": "derived",
      "transformations": ["google_translate"],
      "data_window": null,
      "metric_definition": "Translation does not create a new factual source"
    },
    {
      "source_id": "hubu-collector",
      "provider": "amazon_ads",
      "provider_variant": "report_export",
      "tool_name": "synthetic_whitelisted_report_download",
      "source_type": "synthetic",
      "locator": "synthetic://amazon-ads/exported-by-hubu",
      "collected_at": "2026-07-12T00:00:00Z",
      "scope": "Synthetic report transported by a whitelisted RPA",
      "synthetic": true,
      "source_role": "seller_first_party_data",
      "allowed_dimensions": ["margin", "competition", "risk"],
      "read_only": true,
      "measurement_kind": "observed",
      "original_provider": "amazon_ads",
      "collector": "hubu_rpa",
      "data_window": "synthetic prior 30 days",
      "metric_definition": "Amazon Ads is the factual provider; Hubu only transported the report",
      "account_scope_id": "eval_store_a"
    },
    {
      "source_id": "zhiwubuyan-post",
      "provider": "zhiwubuyan",
      "tool_name": "synthetic_community_post",
      "source_type": "synthetic",
      "locator": "synthetic://community/post-001",
      "collected_at": "2026-07-12T00:00:00Z",
      "scope": "Synthetic unverified community claims",
      "synthetic": true,
      "source_role": "experience_reference",
      "allowed_dimensions": [],
      "read_only": true,
      "measurement_kind": "declared",
      "data_window": null,
      "metric_definition": "Unverified author, market, date and raw report"
    },
    {
      "source_id": "ss-cpc",
      "provider": "sellersprite",
      "tool_name": "synthetic_keyword_cpc_broad",
      "source_type": "synthetic",
      "locator": "synthetic://keyword/lint-roller/broad",
      "collected_at": "2026-07-10T00:00:00Z",
      "scope": "Synthetic broad-match CPC estimate",
      "synthetic": true,
      "source_role": "direct_market_data",
      "allowed_dimensions": ["competition", "risk"],
      "read_only": true,
      "measurement_kind": "estimated",
      "data_window": "synthetic trailing 30 days",
      "metric_definition": "Broad-match CPC estimate"
    },
    {
      "source_id": "sif-cpc",
      "provider": "sif",
      "tool_name": "synthetic_keyword_cpc_exact",
      "source_type": "synthetic",
      "locator": "synthetic://keyword/lint-roller/exact",
      "collected_at": "2026-07-12T00:00:00Z",
      "scope": "Synthetic exact-match CPC estimate",
      "synthetic": true,